{
  "canonical_url": "https://westkitty.github.io/Starsilk_Character_Dossier/machine/entities.json",
  "project_id": "starsilk-character-dossier",
  "record_count": 127,
  "records": [
    {
      "aliases": [],
      "canon_status": "unknown",
      "canonical_url": "https://westkitty.github.io/Starsilk_Character_Dossier/entities/cover/",
      "display_label": "Starsilk Compendium",
      "evidence": [
        {
          "class": "authoritative-content",
          "note": "Published prose/content authority for this section.",
          "source_ref": "src/content/sections/cover.body.html"
        },
        {
          "class": "published-media-provenance",
          "note": "Related media IDs are manifest filenames attached to this section by published context.",
          "source_ref": "docs/asset-manifest.json"
        }
      ],
      "object_type": "section",
      "related_media_ids": [
        "09e2837c1e2a76bc1fadccc2.webp",
        "b3015054b3726a97adbc4a5c.mp4"
      ],
      "source_refs": [
        {
          "anchor": "cover",
          "kind": "authoritative-content",
          "path": "src/content/sections.json"
        },
        {
          "kind": "authoritative-content",
          "path": "src/content/sections/cover.body.html"
        }
      ],
      "spoiler_level": "major",
      "stable_id": "cover",
      "unknowns": [
        "Per-section canon status is not authored by the current source model.",
        "Per-section spoiler classification is not authored; major is a conservative publication default.",
        "object_type describes the published section structure and is not an ontological claim about the subject."
      ],
      "visibility": "public"
    },
    {
      "aliases": [],
      "canon_status": "unknown",
      "canonical_url": "https://westkitty.github.io/Starsilk_Character_Dossier/entities/world/",
      "display_label": "The All is programmable. Meaning is not optional.",
      "evidence": [
        {
          "class": "authoritative-content",
          "note": "Published prose/content authority for this section.",
          "source_ref": "src/content/sections/world.body.html"
        }
      ],
      "object_type": "section",
      "related_media_ids": [],
      "source_refs": [
        {
          "anchor": "world",
          "kind": "authoritative-content",
          "path": "src/content/sections.json"
        },
        {
          "kind": "authoritative-content",
          "path": "src/content/sections/world.body.html"
        },
        {
          "kind": "authoritative-content",
          "path": "src/content/sections/world.title.html"
        }
      ],
      "spoiler_level": "major",
      "stable_id": "world",
      "unknowns": [
        "Per-section canon status is not authored by the current source model.",
        "Per-section spoiler classification is not authored; major is a conservative publication default.",
        "object_type describes the published section structure and is not an ontological claim about the subject."
      ],
      "visibility": "public"
    },
    {
      "aliases": [],
      "canon_status": "unknown",
      "canonical_url": "https://westkitty.github.io/Starsilk_Character_Dossier/entities/chronology/",
      "display_label": "Reality begins as betrayal. The future is built by exclusion.",
      "evidence": [
        {
          "class": "authoritative-content",
          "note": "Published prose/content authority for this section.",
          "source_ref": "src/content/sections/chronology.body.html"
        }
      ],
      "object_type": "chronology-section",
      "related_media_ids": [],
      "source_refs": [
        {
          "anchor": "chronology",
          "kind": "authoritative-content",
          "path": "src/content/sections.json"
        },
        {
          "kind": "authoritative-content",
          "path": "src/content/sections/chronology.body.html"
        },
        {
          "kind": "authoritative-content",
          "path": "src/content/sections/chronology.title.html"
        }
      ],
      "spoiler_level": "major",
      "stable_id": "chronology",
      "unknowns": [
        "Per-section canon status is not authored by the current source model.",
        "Per-section spoiler classification is not authored; major is a conservative publication default.",
        "object_type describes the published section structure and is not an ontological claim about the subject."
      ],
      "visibility": "public"
    },
    {
      "aliases": [],
      "canon_status": "unknown",
      "canonical_url": "https://westkitty.github.io/Starsilk_Character_Dossier/entities/shard-god/",
      "display_label": "Shard-God Tiger",
      "evidence": [
        {
          "class": "authoritative-content",
          "note": "Published prose/content authority for this section.",
          "source_ref": "src/content/sections/shard-god.body.html"
        },
        {
          "class": "published-media-provenance",
          "note": "Related media IDs are manifest filenames attached to this section by published context.",
          "source_ref": "docs/asset-manifest.json"
        }
      ],
      "object_type": "character-section",
      "related_media_ids": [
        "0cb9f2fd4623694ffca06f45.webp",
        "7c7d87d4b3c4ebdf26105e88.webp",
        "a551049aaf868d58772975ad.webp",
        "b8d2878fc5065ecb2bb262e2.webp"
      ],
      "source_refs": [
        {
          "anchor": "shard-god",
          "kind": "authoritative-content",
          "path": "src/content/sections.json"
        },
        {
          "kind": "authoritative-content",
          "path": "src/content/sections/shard-god.body.html"
        },
        {
          "kind": "authoritative-content",
          "path": "src/content/sections/shard-god.title.html"
        }
      ],
      "spoiler_level": "major",
      "stable_id": "shard-god",
      "unknowns": [
        "Per-section canon status is not authored by the current source model.",
        "Per-section spoiler classification is not authored; major is a conservative publication default.",
        "object_type describes the published section structure and is not an ontological claim about the subject."
      ],
      "visibility": "public"
    },
    {
      "aliases": [],
      "canon_status": "unknown",
      "canonical_url": "https://westkitty.github.io/Starsilk_Character_Dossier/entities/codec/",
      "display_label": "Codec",
      "evidence": [
        {
          "class": "authoritative-content",
          "note": "Published prose/content authority for this section.",
          "source_ref": "src/content/sections/codec.body.html"
        },
        {
          "class": "published-media-provenance",
          "note": "Related media IDs are manifest filenames attached to this section by published context.",
          "source_ref": "docs/asset-manifest.json"
        }
      ],
      "object_type": "character-section",
      "related_media_ids": [
        "eb35fd45ca321f41171c4c5d.webp",
        "f0341bf8ea5785a791236f72.webp"
      ],
      "source_refs": [
        {
          "anchor": "codec",
          "kind": "authoritative-content",
          "path": "src/content/sections.json"
        },
        {
          "kind": "authoritative-content",
          "path": "src/content/sections/codec.body.html"
        },
        {
          "kind": "authoritative-content",
          "path": "src/content/sections/codec.title.html"
        }
      ],
      "spoiler_level": "major",
      "stable_id": "codec",
      "unknowns": [
        "Per-section canon status is not authored by the current source model.",
        "Per-section spoiler classification is not authored; major is a conservative publication default.",
        "object_type describes the published section structure and is not an ontological claim about the subject."
      ],
      "visibility": "public"
    },
    {
      "aliases": [],
      "canon_status": "unknown",
      "canonical_url": "https://westkitty.github.io/Starsilk_Character_Dossier/entities/dao/",
      "display_label": "Dao",
      "evidence": [
        {
          "class": "authoritative-content",
          "note": "Published prose/content authority for this section.",
          "source_ref": "src/content/sections/dao.body.html"
        },
        {
          "class": "published-media-provenance",
          "note": "Related media IDs are manifest filenames attached to this section by published context.",
          "source_ref": "docs/asset-manifest.json"
        }
      ],
      "object_type": "character-section",
      "related_media_ids": [
        "e947e78027041e109d68912b.webp"
      ],
      "source_refs": [
        {
          "anchor": "dao",
          "kind": "authoritative-content",
          "path": "src/content/sections.json"
        },
        {
          "kind": "authoritative-content",
          "path": "src/content/sections/dao.body.html"
        },
        {
          "kind": "authoritative-content",
          "path": "src/content/sections/dao.title.html"
        }
      ],
      "spoiler_level": "major",
      "stable_id": "dao",
      "unknowns": [
        "Per-section canon status is not authored by the current source model.",
        "Per-section spoiler classification is not authored; major is a conservative publication default.",
        "object_type describes the published section structure and is not an ontological claim about the subject."
      ],
      "visibility": "public"
    },
    {
      "aliases": [],
      "canon_status": "unknown",
      "canonical_url": "https://westkitty.github.io/Starsilk_Character_Dossier/entities/kail/",
      "display_label": "Kail",
      "evidence": [
        {
          "class": "authoritative-content",
          "note": "Published prose/content authority for this section.",
          "source_ref": "src/content/sections/kail.body.html"
        },
        {
          "class": "published-media-provenance",